{
  "id": "au",
  "iso2": "au",
  "name": "Australia",
  "adjective": "Australian",
  "scope": "worldwide",
  "region": "Oceania",
  "capital": "Canberra",
  "currency": "AUD",
  "membership": {
    "eu": false,
    "eea": false,
    "nordic": false,
    "schengen": false
  },
  "targetIntake": "2027-autumn",
  "tagline": "One national IB conversion, and admission decided by a number you can look up",
  "summary": "Australia is unusual in how legible it is. The International Baccalaureate is not merely accepted here; it is converted, on a published national schedule agreed by all the state admissions centres, into an ATAR-like Combined Rank, and universities state the rank each degree needs. That makes it one of the few destinations where a Danish student can work out in an afternoon whether they are in range. Everything else about it is harder. The academic year runs from late February, so finishing the IB in May 2027 leads either to a July 2027 mid-year start, which many degrees do not offer, or to February 2028. Applying is institution-by-institution almost everywhere. And the student visa carries a real financial test that has to be satisfied on top of full international tuition.",
  "whyConsider": [
    "The entry rule is arithmetic. UAC publishes the IB-to-Combined-Rank schedule, the conversion is national, and a degree's required rank is on its own page.",
    "Three-year bachelor's degrees, so you finish in the same time as in Denmark, with a fourth honours year only if you choose it.",
    "In New South Wales and the ACT an IB Diploma puts you inside a shared admissions system - one application, one fee, several universities. It is the only one in Australia open to a candidate sitting the exams in Europe.",
    "A conditional offer through UAC arrives about 48 hours after you apply, on predicted grades, and is explicitly usable for pre-visa assessment.",
    "A degree gives access to the Temporary Graduate visa (subclass 485), which usually allows a stay of two to three years afterwards."
  ],
  "watchOuts": [
    "Two conversion tables sit on one UAC page and the wrong one looks more authoritative. The quarter-point IB Admissions Score schedule is only for candidates who sat the IB in Australia; a Danish candidate is converted from the whole diploma score.",
    "The conversion schedule is re-determined every February and the values move. A table copied last year is the wrong table.",
    "There is no national application portal, and the state admissions centres are not interchangeable. UAC will take an offshore IB candidate. VTAC, SATAC and TISC will not. Queensland is unresolved here.",
    "Hemisphere timing. A May 2027 session leads to July 2027 only if that degree admits mid-year - engineering, health and most professional degrees do not - and otherwise to February 2028.",
    "The whole Australian admissions calendar assumes IB results arrive in December, from the November session. Yours arrive in July, between one cycle and the next, and UAC says in its own words that it cannot guarantee they will be assessed in time for a specific offer round.",
    "The visa's financial test is cumulative and is not the living-cost figure alone: AUD 29,710 of living costs, plus the first twelve months of the actual course fee, plus about AUD 2,000 of travel from Europe."
  ],
  "ibRecognition": {
    "accepted": true,
    "minimumPoints": "No national minimum, because entry is not decided by a points floor. The IB total is converted to a Combined Rank and each degree publishes the rank it wants. The bottom of the published conversion is 24 points, which is the score at which the Diploma is awarded at all.",
    "subjectLevelRule": "The rank decides admission; named prerequisite subjects sit on top of it. Typically mathematics at a specified level for engineering, economics and science, and chemistry or biology for health degrees. Whether a Standard Level subject satisfies a prerequisite is decided by the university, not by the admissions centre, and the mapping between IB subject grades and state Year 12 subject results is set by each tertiary admissions centre separately.",
    "gradeConversion": "The IB Diploma is converted to a Combined Rank, an ATAR-like value, on a schedule determined nationally by the Australasian Conference of Tertiary Admissions Centres and re-set every February. Two schedules are published on one page: one converting a fine-grained IB Admissions Score in quarter-point steps, which applies only to candidates who sat the IB in Australia from November 2022; and the one recorded here, which converts the whole diploma score and applies to everyone else, including a candidate sitting the May session in Denmark.",
    "conversionScale": "Combined Rank, an ATAR-like value from 0 to 99.95. UAC states it is comparable with the ATAR for tertiary entrance in all Australian states and territories, so a rank quoted by a university in Perth means the same as one quoted in Sydney.",
    "conversionTable": [
      { "ib": 45, "local": 99.95 },
      { "ib": 44, "local": 99.75 },
      { "ib": 43, "local": 99.35 },
      { "ib": 42, "local": 98.65 },
      { "ib": 41, "local": 97.8 },
      { "ib": 40, "local": 96.85 },
      { "ib": 39, "local": 95.8 },
      { "ib": 38, "local": 94.65 },
      { "ib": 37, "local": 93.6 },
      { "ib": 36, "local": 92.25 },
      { "ib": 35, "local": 90.75 },
      { "ib": 34, "local": 89 },
      { "ib": 33, "local": 86.65 },
      { "ib": 32, "local": 84.2 },
      { "ib": 31, "local": 81.7 },
      { "ib": 30, "local": 79.3 },
      { "ib": 29, "local": 77.1 },
      { "ib": 28, "local": 74.65 },
      { "ib": 27, "local": 72.25 },
      { "ib": 26, "local": 69.55 },
      { "ib": 25, "local": 66.95 },
      { "ib": 24, "local": 64.6, "note": "The bottom of the published schedule. 24 points is also the score at which the Diploma is awarded." }
    ],
    "notes": [
      "Published by UAC for offers made from August 2026. Re-check in February, when the schedule is re-determined.",
      "This is the table for applicants who did not sit the IB in Australia since November 2022. The other table on the same page reads 24.00 to 64.40 and 30.00 to 78.20 for the same scores, and is not yours.",
      "Because you are converted from a whole number, there is no partial credit for sitting high within a grade band. Every point is a step, and the steps are largest in the high twenties and low thirties.",
      "A degree page quoting a 'lowest selection rank' or a 'guaranteed entry rank' is quoting this scale. A rank of 90 is roughly IB 34 to 35 on the current schedule."
    ],
    "evidence": [
      "ev-uac-ib-combined-rank-2026",
      "ev-actac-ib-atar-method",
      "ev-uac-combined-rank-national"
    ]
  },
  "language": {
    "englishTaughtBachelors": "The whole system. Every bachelor's degree in Australia is taught in English.",
    "englishProof": "Two separate requirements that are easy to conflate. The university sets its own, and commonly accepts an IB Diploma with English A as evidence; the Department of Home Affairs sets its own for the subclass 500 visa, and can ask for test evidence at any point while the application is being processed, even where the document checklist did not ask for it up front. Exact thresholds were not verified per institution here.",
    "localLanguageRequired": false,
    "notes": [
      "Meeting the university's English requirement does not satisfy the visa's. Check the subclass 500 English criteria separately."
    ]
  },
  "feeContext": [
    {
      "applicantGroup": "eu-eea-ch",
      "feeStatus": "international-rate",
      "summary": "There is no EU or EEA fee category in Australia and no reciprocal arrangement with Denmark. Commonwealth Supported Places, the subsidised domestic rate, are for Australian and New Zealand citizens and permanent residents. A Danish student pays the full international fee.",
      "priceYear": "2026",
      "evidence": [
        "ev-unsw-international-fees-2026"
      ]
    },
    {
      "applicantGroup": "non-eu",
      "feeStatus": "international-rate",
      "summary": "Set per institution and per faculty, with the spread inside one university wider than the spread between universities. Worked example, UNSW Sydney 2026: AUD 985 per unit of credit for Arts, AUD 1,000 for Design, AUD 1,090 for Architecture and AUD 1,180 for Accounting and Actuarial Studies, on a standard year of 48 units of credit - about AUD 47,300 for Arts and AUD 56,600 for Accounting. Medicine, dentistry and veterinary science are substantially higher. Whether the fee can rise mid-degree is not established here.",
      "typicalRange": "Roughly AUD 47,000 to 57,000 a year at a research university for arts, design and business",
      "priceYear": "2026",
      "evidence": [
        "ev-unsw-international-fees-2026"
      ]
    }
  ],
  "livingContext": {
    "livingCostYear": "The Department of Home Affairs requires evidence of AUD 29,710 of living costs for twelve months for a single student, about AUD 2,476 a month. That is the visa minimum rather than a budget, and Home Affairs says so: actual costs vary across Australia and are higher in Sydney and Melbourne.",
    "housing": "Australian universities house a much smaller share of their students than British or American ones, so most international students rent privately or take a place in purpose-built student accommodation. Sydney and Melbourne are expensive and competitive; Adelaide, Hobart, Wollongong and Canberra are easier. Apply to residential colleges as soon as you accept an offer.",
    "healthcare": "Overseas Student Health Cover is a condition of the subclass 500 visa and must cover the whole length of it. You buy it from an approved Australian insurer, usually through the university when you accept. Denmark has no reciprocal healthcare agreement that replaces it, and the EHIC is not valid in Australia.",